{
  "$schema": "../schema/job.schema.json",
  "id": "bard",
  "name": "Бард",
  "description": "Вторая профессия Лучника: песни, усиливающие отряд.",
  "tier": 2,
  "from": [
    "archer"
  ],
  "maxJobLevel": 50,
  "role": "support",
  "baseStats": {
    "hp": 2150,
    "atk": 220,
    "def": 45,
    "spd": 105
  },
  "growth": {
    "hp": 50,
    "atk": 6,
    "def": 1.2,
    "spd": 0
  },
  "basic": "basic_ranged",
  "skills": [
    {
      "jobLevel": 1,
      "skill": "job_bard_musical_strike"
    },
    {
      "jobLevel": 10,
      "skill": "job_bard_poem_of_bragi"
    },
    {
      "jobLevel": 20,
      "skill": "job_bard_whistle"
    },
    {
      "jobLevel": 30,
      "skill": "job_bard_apple_of_idun"
    },
    {
      "jobLevel": 40,
      "skill": "job_bard_frost_joker"
    }
  ],
  "visual": {
    "sprite": "bard",
    "hitFx": "fx_hit",
    "projectile": "fx_arrow"
  }
}
