{
  "$schema": "../schema/job.schema.json",
  "id": "paladin",
  "name": "Паладин",
  "description": "Ветеранский ранг: Паладин. Автоматически при золотой редкости и уровне 70.",
  "tier": 3,
  "from": [
    "crusader"
  ],
  "maxJobLevel": 100,
  "role": "tank",
  "baseStats": {
    "hp": 3100,
    "atk": 200,
    "def": 110,
    "spd": 95
  },
  "growth": {
    "hp": 75,
    "atk": 5,
    "def": 3,
    "spd": 0
  },
  "basic": "basic_melee",
  "skills": [
    {
      "jobLevel": 70,
      "skill": "adv_paladin_oath"
    },
    {
      "jobLevel": 80,
      "skill": "adv_paladin_judgement"
    },
    {
      "jobLevel": 90,
      "skill": "adv_paladin_consecration"
    },
    {
      "jobLevel": 100,
      "skill": "adv_paladin_resolve"
    }
  ],
  "visual": {
    "sprite": "paladin_m",
    "hitFx": "fx_hit"
  },
  "behavior": "paladin",
  "nameF": "Паладин"
}
