{
  "$schema": "../schema/job.schema.json",
  "id": "swordman",
  "name": "Мечник",
  "nameF": "Мечница",
  "description": "Первая профессия ветки ближнего боя. Дальше — Рыцарь или Крестоносец.",
  "tier": 1,
  "from": [
    "novice"
  ],
  "maxJobLevel": 50,
  "role": "tank",
  "baseStats": {
    "hp": 1200,
    "atk": 80,
    "def": 35,
    "spd": 95
  },
  "growth": {
    "hp": 60,
    "atk": 5,
    "def": 2,
    "spd": 0
  },
  "basic": "basic_melee",
  "skills": [
    {
      "jobLevel": 1,
      "skill": "swordman_bash"
    },
    {
      "jobLevel": 10,
      "skill": "swordman_endure"
    },
    {
      "jobLevel": 20,
      "skill": "job_swordman_magnum_break"
    },
    {
      "jobLevel": 30,
      "skill": "job_swordman_hp_recovery"
    },
    {
      "jobLevel": 40,
      "skill": "job_swordman_provoke"
    }
  ],
  "visual": {
    "sprite": "swordman",
    "hitFx": "fx_hit"
  },
  "behavior": "line"
}
